{
  "schema_version": 1,
  "description": "Default durable memory / graph settings. Override in target repo with .agentic-swe/memory.json (merge) or AGENTIC_SWE_MEMORY_CONFIG=/abs/path.json.",
  "store": {
    "sqlite_relative_path": "memory.sqlite",
    "directory_relative": ".agentic-swe"
  },
  "ingest": {
    "include_globs": [
      "AGENTS.md",
      "CLAUDE.md",
      "docs/**/*.md",
      ".worklogs/**/*.md"
    ],
    "exclude_globs": [
      "**/node_modules/**",
      "**/dist/**",
      "**/.git/**",
      "**/coverage/**"
    ],
    "max_file_bytes": 1048576,
    "max_chunk_chars": 8000,
    "chunk_extensions": [".md"]
  },
  "prime": {
    "max_chars_out": 12000,
    "max_fts_hits": 12,
    "retrieval_mode": "auto",
    "rrf_k": 60,
    "semantic_candidate_limit": 8000
  },
  "embeddings": {
    "enabled": false,
    "provider": "none",
    "model": "nomic-embed-text",
    "ollama_host": "http://127.0.0.1:11434",
    "openai_model": "text-embedding-3-small",
    "test_dimension": 32
  },
  "compact": {
    "include_names": ["progress.md", "design.md", "feasibility.md", "implementation.md"],
    "max_chars_per_file": 8000,
    "max_total_chars": 24000,
    "output_filename": "context-compact.md"
  },
  "graph": {
    "enabled": true,
    "package_manifests": ["package.json", "package-lock.json"]
  },
  "import_adapter": {
    "enabled": false,
    "max_nodes_per_merge": 5000,
    "max_edges_per_merge": 20000
  },
  "sliding": {
    "recent_turns_verbatim": 8,
    "max_old_turn_chars": 240,
    "output_filename": "sliding-summary.md",
    "llm_enabled": false,
    "llm_model": "gpt-4o-mini"
  }
}
